{
  "$schema": "https://json-schema.org/draft/2020-12/schema",
  "title": "CVE Triage Record",
  "type": "object",
  "required": [
    "cve",
    "product",
    "priority",
    "owner",
    "affected_assets",
    "decision"
  ],
  "properties": {
    "cve": {
      "type": "string"
    },
    "product": {
      "type": "string"
    },
    "priority": {
      "type": "string",
      "enum": [
        "P0",
        "P1",
        "P2",
        "P3",
        "Informational"
      ]
    },
    "owner": {
      "type": "string"
    },
    "affected_assets": {
      "type": "array",
      "items": {
        "type": "string"
      }
    },
    "exposure": {
      "type": "string"
    },
    "exploit_status": {
      "type": "string"
    },
    "mitigation": {
      "type": "string"
    },
    "detection_coverage": {
      "type": "string"
    },
    "decision": {
      "type": "string"
    }
  }
}
