{
  "cve": "CVE-YYYY-NNNN",
  "product": "Example Gateway",
  "priority": "P1",
  "owner": "Network Security Team",
  "affected_assets": [
    "gateway-01.example.com",
    "gateway-02.example.com"
  ],
  "exposure": "internet-facing",
  "exploit_status": "public exploitation reported in trusted sources",
  "mitigation": "patch to fixed version and restrict management interface",
  "detection_coverage": "web logs, WAF logs, EDR, outbound network telemetry",
  "decision": "accelerated remediation with detection and post-patch validation"
}
